{"$defs":{"CompletionCriterionDraftMapping":{"additionalProperties":false,"properties":{"criterion":{"maxLength":65536,"minLength":1,"title":"Criterion","type":"string"},"criterion_index":{"minimum":0,"title":"Criterion Index","type":"integer"},"evidence_bindings":{"items":{"$ref":"#/$defs/EvidenceBinding"},"title":"Evidence Bindings","type":"array"},"explanation":{"maxLength":65536,"minLength":1,"title":"Explanation","type":"string"},"satisfied":{"title":"Satisfied","type":"boolean"}},"required":["criterion_index","criterion","satisfied","evidence_bindings","explanation"],"title":"CompletionCriterionDraftMapping","type":"object"},"EvidenceBinding":{"additionalProperties":false,"properties":{"evidence_proposal_key":{"anyOf":[{"maxLength":65536,"minLength":1,"type":"string"},{"type":"null"}],"title":"Evidence Proposal Key"},"existing_evidence_id":{"anyOf":[{"pattern":"^[0-9a-f]{8}-[0-9a-f]{4}-[0-9a-f]{4}-[0-9a-f]{4}-[0-9a-f]{12}$","type":"string"},{"type":"null"}],"title":"Existing Evidence Id"}},"required":["existing_evidence_id","evidence_proposal_key"],"title":"EvidenceBinding","type":"object"}},"$schema":"https://json-schema.org/draft/2020-12/schema","additionalProperties":false,"properties":{"candidate_statement":{"maxLength":65536,"minLength":1,"title":"Candidate Statement","type":"string"},"completion_criteria_mapping":{"items":{"$ref":"#/$defs/CompletionCriterionDraftMapping"},"minItems":1,"title":"Completion Criteria Mapping","type":"array"},"format_id":{"const":"problem-locator-diagnosis-v1","title":"Format Id","type":"string"},"problem_statement":{"maxLength":65536,"minLength":1,"title":"Problem Statement","type":"string"},"schema_version":{"const":1,"title":"Schema Version","type":"integer"},"supporting_evidence_bindings":{"items":{"$ref":"#/$defs/EvidenceBinding"},"title":"Supporting Evidence Bindings","type":"array"}},"required":["schema_version","format_id","problem_statement","candidate_statement","supporting_evidence_bindings","completion_criteria_mapping"],"title":"UserResultPayload","type":"object"}
