{"candidate_statement":"The inventory RPC exceeded its deadline.","completion_criteria_mapping":[{"criterion":"Identify the timed-out request.","criterion_index":0,"evidence_bindings":[{"evidence_proposal_key":null,"existing_evidence_id":"00000000-0000-0000-0000-000000000040"},{"evidence_proposal_key":null,"existing_evidence_id":"00000000-0000-0000-0000-000000000041"}],"explanation":"The request identifier appears in the parsed log.","satisfied":true}],"format_id":"problem-locator-diagnosis-v1","problem_statement":"A payment service call to inventory times out.","schema_version":1,"supporting_evidence_bindings":[{"evidence_proposal_key":null,"existing_evidence_id":"00000000-0000-0000-0000-000000000040"},{"evidence_proposal_key":null,"existing_evidence_id":"00000000-0000-0000-0000-000000000041"}]}
